{
  "id": "hybrid-schur-vdw-3color-le-13",
  "schema_version": "0.1",
  "claim": {
    "statement": "Every 3-coloring of {1,...,13} contains either a monochromatic Schur triple x+y=z or a monochromatic 3-term arithmetic progression; equivalently, no 3-coloring of [13] avoids both obstruction families.",
    "kind": "impossibility",
    "negation_of": "a 3-coloring of {1,...,13} with no monochromatic Schur triple and no monochromatic 3-term arithmetic progression"
  },
  "domain": "combinatorics/hybrid-Schur-van-der-Waerden",
  "rung": {
    "level": "R3",
    "name": "exhaustive-recomputation",
    "trusted_base": [
      "a small Python exhaustive finite-coloring checker (tools/hybrid_schur_vdw_check.py)",
      "the declared hybrid obstruction spec: Schur triples x+y=z and 3-term APs in [n]",
      "a lower-bound witness for [12] checked by the same script",
      "agrees with the separate R2 CNF/RUP certificate for the same finite claim"
    ]
  },
  "certificate": {
    "kind": "finite-exhaustive-search",
    "meta": {
      "n": 13,
      "colors": 3,
      "schur_triple_count": 42,
      "ap_triple_count": 36,
      "combined_unique_triple_count": 74,
      "lower_bound_witness_n": 12,
      "lower_bound_witness": [0, 1, 0, 2, 1, 2, 2, 0, 2, 0, 1, 1],
      "lower_bound_witness_meaning": "This 3-coloring of [12] avoids both monochromatic Schur triples and monochromatic 3-term APs, so the certified [13] barrier is tight for this spec.",
      "cross_reference": "same finite claim as hybrid-schur-vdw-3color-le-13-r2 (R2 CNF/RUP certificate)"
    }
  },
  "checker": {
    "kind": "hybrid-schur-vdw-exhaustive",
    "n": 13,
    "colors": 3,
    "lower_bound_witness": [0, 1, 0, 2, 1, 2, 2, 0, 2, 0, 1, 1]
  },
  "status": "live",
  "provenance": {
    "source_package": "barrier-atlas",
    "pipeline": "bounded discovery scout found SAT through n=12 and UNSAT at n=13; live checker re-enumerates the finite obstruction spec and validates the n=12 witness before certifying the n=13 barrier"
  },
  "one_directional": "This R3 entry fails closed if the lower-bound witness is invalid or if any counterexample coloring of [13] is found. A bug in the Python exhaustive checker or in the declared hybrid spec could in principle cause a false accept, so this corroborating entry stays R3 even though the same finite claim also has a separate R2 CNF/RUP certificate. The claim is a new atlas-certified finite hybrid barrier, not a literature-priority claim."
}
