{
  "id": "vdw-3-3-le-27",
  "schema_version": "0.1",
  "claim": {
    "statement": "Every 3-coloring of {1,...,27} contains a monochromatic 3-term arithmetic progression (van der Waerden W(3,3) <= 27).",
    "kind": "impossibility",
    "negation_of": "a 3-coloring of {1,...,27} with no monochromatic 3-term arithmetic progression"
  },
  "domain": "combinatorics/van-der-Waerden",
  "rung": {
    "level": "R2",
    "name": "verified-checker-program",
    "trusted_base": [
      "Lean compiler",
      "checkProofArr_unsat (Lean-proved sound: checkProofArr f steps = true -> Unsat f)",
      "untrusted certificate parser"
    ]
  },
  "certificate": {
    "kind": "lrat-flat",
    "path": "certs/samples_w33.cert",
    "sha256": "f280ae0847138a9e4332446de277ef9e870d27571d33b80d0b3a0f68a7aa4b7a",
    "meta": { "original_clauses": 615, "proof_steps": 6179, "format": "flat space-separated DIMACS ints consumed by parseCert" }
  },
  "checker": {
    "kind": "lratcheck",
    "cert": "certs/samples_w33.cert",
    "accept_pattern": "VERIFIED",
    "binary_env": "LRATCHECK_BIN",
    "binary_default": "../dist/lean-verification-journey/.lake/build/bin/lratcheck"
  },
  "status": "live",
  "provenance": {
    "source_package": "lean-verification-journey",
    "pipeline": "glucose (DRAT) -> drat-trim (LRAT, s VERIFIED) -> flatten -> lratcheck"
  },
  "one_directional": "checkProofArr_unsat (kernel-proved) guarantees lratcheck can never falsely certify a parsed CNF as UNSAT -- a bug only causes a refusal. The remaining trusted link is the ENCODER: that this CNF faithfully encodes W(3,3). The atlas binds the exact bytes by sha256 + cross-checks parsed clause/step counts, so tampering fails closed; the claim<->CNF encoding itself is trusted, not checked here."
}
